{
  "id": "one-dark",
  "name": "One Dark",
  "version": "1.0.0",
  "mode": "dark",
  "app_mode": "grimoire",
  "author": "hunter-read",
  "description": "Atom's One Dark and One Light, brought to Grimoire. The familiar editor palette — slate-blue surfaces and soft syntax hues in dark, warm off-white and deeper inks in light — with the gold accent traded for One's blue. Follows System, so it tracks your OS setting.",
  "homepage": "https://github.com/grimoire-codex/community-add-ons",
  "grimoire_min_version": "1.5.6",
  "variants": {
    "dark": {
      "bg-deep": "#21252b",
      "bg-panel": "#282c34",
      "bg-card": "#2c313a",
      "bg-card-hover": "#31363f",
      "bg-input": "#1b1f23",
      "border": "#464d5a",
      "border-light": "#5a6272",
      "accent": "#61afef",
      "accent-dim": "#63a8e0",
      "accent-bright": "#9acbf7",
      "accent-alt": "#d08ee6",
      "on-accent": "#21252b",
      "text": "#b6bdc9",
      "text-dim": "#a2aab8",
      "text-muted": "#9aa2b1",
      "red": "#ec7f88",
      "green": "#9fcb81",
      "blue": "#61afef",
      "danger": "#ec7f88",
      "danger-fill": "#ec7f88",
      "on-danger": "#21252b",
      "warning": "#d8a570",
      "success": "#9fcb81",
      "on-media": "#ffffff",
      "on-media-border": "rgba(255, 255, 255, 0.6)",
      "tag-bg": "#333842",
      "tag-border": "#4b5263",
      "mark-bg": "rgba(229, 192, 123, 0.35)",
      "invite-bg": "rgba(97, 175, 239, 0.16)",
      "overlay": "rgba(24, 27, 32, 0.8)",
      "shadow": "rgba(0, 0, 0, 0.6)",
      "scrim": "rgba(0, 0, 0, 0.8)",
      "scrim-strong": "rgba(0, 0, 0, 0.92)",
      "type-book": "#d08ee6",
      "type-map": "#61afef",
      "type-token": "#9fcb81",
      "type-audio": "#d8a570",
      "type-file": "#e5c07b",
      "variant": "#5cc0cc"
    },
    "light": {
      "bg-deep": "#f0f0f1",
      "bg-panel": "#fafafa",
      "bg-card": "#ffffff",
      "bg-card-hover": "#e9e9ea",
      "bg-input": "#ffffff",
      "border": "#bcbcc1",
      "border-light": "#93949a",
      "accent": "#2f6099",
      "accent-dim": "#26507f",
      "accent-bright": "#3569a8",
      "accent-alt": "#8b46b5",
      "on-accent": "#ffffff",
      "text": "#383a42",
      "text-dim": "#4f525d",
      "text-muted": "#5f626c",
      "red": "#b52a32",
      "green": "#396f1d",
      "blue": "#2f6099",
      "danger": "#b52a32",
      "danger-fill": "#b52a32",
      "on-danger": "#ffffff",
      "warning": "#8a5109",
      "success": "#396f1d",
      "on-media": "#ffffff",
      "on-media-border": "rgba(255, 255, 255, 0.6)",
      "tag-bg": "#eaeaeb",
      "tag-border": "#a0a1a7",
      "mark-bg": "rgba(224, 175, 46, 0.4)",
      "invite-bg": "rgba(58, 111, 176, 0.12)",
      "overlay": "rgba(56, 58, 66, 0.55)",
      "shadow": "rgba(56, 58, 66, 0.25)",
      "scrim": "rgba(0, 0, 0, 0.8)",
      "scrim-strong": "rgba(0, 0, 0, 0.92)",
      "type-book": "#8b46b5",
      "type-map": "#2f6099",
      "type-token": "#396f1d",
      "type-audio": "#8a5109",
      "type-file": "#6f5010",
      "variant": "#0a6e76"
    }
  }
}
