{
  "id": "high-contrast",
  "name": "High Contrast",
  "version": "1.0.0",
  "mode": "dark",
  "app_mode": "grimoire",
  "author": "hunter-read",
  "description": "Maximum legibility in both light and dark: pure black or pure white surfaces, full-strength text, and saturated accents. Every foreground clears WCAG AAA (7:1) against every background, and the low-contrast greys of the default theme are gone. Follows System, so it tracks your OS setting. Raises luminance contrast only — it does not address colourblindness, which needs more than a change of colour.",
  "homepage": "https://github.com/grimoire-codex/community-add-ons",
  "grimoire_min_version": "1.5.6",
  "variants": {
    "dark": {
      "bg-deep": "#000000",
      "bg-panel": "#050505",
      "bg-card": "#0a0a0a",
      "bg-card-hover": "#1a1a1a",
      "bg-input": "#000000",
      "border": "#767676",
      "border-light": "#a0a0a0",
      "accent": "#ffd54a",
      "accent-dim": "#e6bf35",
      "accent-bright": "#ffe680",
      "accent-alt": "#ffb347",
      "on-accent": "#000000",
      "text": "#ffffff",
      "text-dim": "#e8e8e8",
      "text-muted": "#c8c8c8",
      "red": "#ff8a80",
      "green": "#7dffb0",
      "blue": "#8ecbff",
      "danger": "#ff8a80",
      "danger-fill": "#ff8a80",
      "on-danger": "#000000",
      "warning": "#ffc266",
      "success": "#7dffb0",
      "on-media": "#ffffff",
      "on-media-border": "rgba(255, 255, 255, 0.6)",
      "tag-bg": "#1a1a1a",
      "tag-border": "#a0a0a0",
      "mark-bg": "rgba(255, 213, 74, 0.45)",
      "invite-bg": "rgba(255, 213, 74, 0.2)",
      "overlay": "rgba(0, 0, 0, 0.85)",
      "shadow": "rgba(0, 0, 0, 0.9)",
      "scrim": "rgba(0, 0, 0, 0.8)",
      "scrim-strong": "rgba(0, 0, 0, 0.92)",
      "type-book": "#d0bcff",
      "type-map": "#9ecfff",
      "type-token": "#7dffb0",
      "type-audio": "#ffc48c",
      "type-file": "#ffe680",
      "variant": "#5fe3d6"
    },
    "light": {
      "bg-deep": "#ffffff",
      "bg-panel": "#ffffff",
      "bg-card": "#ffffff",
      "bg-card-hover": "#ebebeb",
      "bg-input": "#ffffff",
      "border": "#595959",
      "border-light": "#333333",
      "accent": "#6b4a00",
      "accent-dim": "#523900",
      "accent-bright": "#725000",
      "accent-alt": "#8a3b00",
      "on-accent": "#ffffff",
      "text": "#000000",
      "text-dim": "#1a1a1a",
      "text-muted": "#333333",
      "red": "#a30000",
      "green": "#005c2e",
      "blue": "#00457a",
      "danger": "#a30000",
      "danger-fill": "#a30000",
      "on-danger": "#ffffff",
      "warning": "#7a3d00",
      "success": "#005c2e",
      "on-media": "#ffffff",
      "on-media-border": "rgba(255, 255, 255, 0.6)",
      "tag-bg": "#ebebeb",
      "tag-border": "#333333",
      "mark-bg": "rgba(255, 214, 0, 0.55)",
      "invite-bg": "rgba(107, 74, 0, 0.12)",
      "overlay": "rgba(0, 0, 0, 0.7)",
      "shadow": "rgba(0, 0, 0, 0.45)",
      "scrim": "rgba(0, 0, 0, 0.8)",
      "scrim-strong": "rgba(0, 0, 0, 0.92)",
      "type-book": "#4b0082",
      "type-map": "#00457a",
      "type-token": "#005c2e",
      "type-audio": "#8a3b00",
      "type-file": "#6b4a00",
      "variant": "#00504a"
    }
  }
}
